{
  "schemaVersion": 1,
  "generatorVersion": "atlas-kt-test",
  "module": {
    "id": "dev.example:test-support:1.0.0",
    "displayName": "test-support",
    "version": "1.0.0",
    "category": "gradle-jvm-artifact"
  },
  "sourceLanguage": "kotlin",
  "elements": [
    {
      "id": "support-service",
      "name": "TestCatalog",
      "kind": "class",
      "qualifiedName": "dev.example.support.TestCatalog",
      "sourcePath": "src/main/kotlin/dev/example/support/TestCatalog.kt"
    }
  ],
  "relationships": [
    {
      "id": "support-application",
      "sourceElementId": "support-service",
      "kind": "references",
      "target": {
        "moduleId": "dev.example:app:1.0.0",
        "elementId": "application-service"
      }
    }
  ]
}
