{
  "schemaVersion": 1,
  "generatorVersion": "atlas-kt-test",
  "module": {
    "id": "dev.example:app:1.0.0",
    "displayName": "app",
    "version": "1.0.0",
    "category": "gradle-jvm-artifact"
  },
  "sourceLanguage": "kotlin",
  "elements": [
    {
      "id": "application-service",
      "name": "ApplicationService",
      "kind": "class",
      "qualifiedName": "dev.example.app.feature.ApplicationService",
      "sourcePath": "src/main/kotlin/dev/example/app/feature/ApplicationService.kt"
    }
  ],
  "relationships": [
    {
      "id": "application-support",
      "sourceElementId": "application-service",
      "kind": "references",
      "target": {
        "moduleId": "dev.example:test-support:1.0.0",
        "elementId": "support-service"
      }
    }
  ]
}
